sent_id,context,eng,acu,afr,ake,alb,amh,amu,ara,arm,baq,bsn,bul,cak,ceb,cha,chi,chq,chr,chu,cjp,cni,cop,crp,cze,dan,deu,dik,dje,dop,epo,est,ewe,fin,fra,gbi,gla,glv,got,grc,gre,guj,heb,hin,hrv,hun,ind,isl,ita,jak,jap,jiv,kab,kbh,kor,lat,lav,lit,mam,mao,mar,mya,nep,nhg,nld,nor,ojb,pck,pes,plt,pol,por,pot,ppk,quc,quw,rom,rum,rus,shi,slk,slv,sna,som,spa,srp,ssw,swe,syr,tel,tgl,tha,tmh,tur,ukr,usp,wal,wol,xho,zul
b.GEN.8.22,While the earth remaineth seedtime and harvest and cold and heat and summer and winter and day and night shall not cease,While,NA,NULL,NA,NULL,NULL,NA,NULL,NULL,NA,NA,Догде,NA,Samtang,NA,NULL,NA,NA,NA,NA,NA,NA,NULL,NULL,Herefter,Solange,NA,NULL,NA,NULL,Niikaua,NA,kuin,Tant,NA,NA,NA,NA,NA,οσω,NA,NULL,ज,NULL,Ennekutánna,NULL,Meðan,NULL,NA,NULL,NA,NA,NA,NULL,NULL,NA,Kol,NA,NULL,NULL,NULL,NA,NA,Zolang,lenge,NA,NULL,مادامی,Raha,NULL,Enquanto,NA,NA,NA,NA,NA,NULL,NULL,NA,Odteraz,Dokler,Nguva,Intuu,Mientras,NULL,NA,länge,NA,ల,Samantalang,ในขณะท,Iket,NULL,NA,NA,NA,NA,Kuthabathela,NA
b.GEN.19.16,And while he lingered the men laid hold upon his hand and upon the hand of his wife and upon the hand of his two daughters the LORD being merciful unto him and they brought him forth and set him without the city,while,NA,NULL,NA,NULL,NULL,NA,توانى,NULL,NA,NA,NULL,NA,NULL,NA,NULL,NA,NA,NA,NA,NA,NA,t,když,da,NULL,NA,NULL,NA,cxar,kui,NA,kun,comme,NA,NA,NA,NA,NA,NULL,NA,NULL,NULL,NULL,NULL,NULL,er,NULL,NA,NULL,NA,NA,NA,NULL,NULL,NA,NULL,NA,i,NULL,NULL,NULL,NA,nog,da,NA,lai,چون,nitaredretra,gdy,NULL,NA,NA,NA,NA,NA,NULL,NULL,NA,keď,NULL,NULL,NULL,NULL,NULL,NA,då,NA,NULL,NULL,ขณะท,NULL,NULL,NA,NA,NA,NA,NULL,NA
b.GEN.25.6,But unto the sons of the concubines which Abraham had Abraham gave gifts and sent them away from Isaac his son while he yet lived eastward unto the east country,while,NA,NULL,NA,sa,ሳለ,NA,وهو,հեռացրեց,NA,NA,докато,NA,NULL,NA,候,NA,NA,NA,NA,NA,NA,NULL,NULL,medens,dieweil,NA,za,NA,dum,eluajal,NA,eläessänsä,tandis,NA,NA,NA,NA,NA,NULL,NA,בעודנו,NULL,NULL,mellõl,NULL,meðan,mentre,NA,NULL,NA,NA,NA,생전에,dum,NA,NULL,NA,ana,NA,စဉ,NA,NA,NULL,mens,NA,damlai,NULL,dieny,NULL,NULL,NA,NA,NA,NA,NA,cînd,NULL,NA,kým,dokler,achiri,intuu,mientras,NULL,NA,medan,NA,డగ,samantalang,เม,NULL,İshaktan,NA,NA,NA,NA,NULL,NA
b.GEN.29.9,And while he yet spake with them Rachel came with her father s sheep for she kept them,while,NA,NULL,NA,NULL,NULL,NA,NULL,Մինչ,NA,NA,Докато,NA,Samtang,NA,候,NA,NA,NA,NA,NA,NA,lè,NULL,Medens,NULL,NA,NULL,NA,Dum,NULL,NA,NULL,Comme,NA,NA,NA,NA,NA,ενω,NA,עודנו,NULL,Dok,mikor,Selagi,NULL,NULL,NA,NULL,NA,NA,NA,NULL,NULL,NA,NULL,NA,NULL,असत,NULL,रह,NA,NULL,Mens,NA,laiin,NULL,NULL,gdy,Enquanto,NA,NA,NA,NA,NA,cînd,NULL,NA,kým,NULL,achiri,intuu,Estando,Dok,NA,Medan,NA,డగ,NULL,NULL,NULL,konuşurken,NA,NA,NA,NA,kaloku,NA
b.GEN.45.1,Then Joseph could not refrain himself before all them that stood by him and he cried Cause every man to go out from me And there stood no man with him while Joseph made himself known unto his brethren,while,NA,toe,NA,kur,NULL,NA,NULL,NULL,NA,NA,когато,NA,samtang,NA,時,NA,NA,NA,NA,NA,NA,lè,když,da,da,NA,waato,NA,kiam,kui,NA,kun,quand,NA,NA,NA,NA,NA,ενω,NA,בהתודע,NULL,NULL,mikor,NULL,NULL,mentre,NA,NULL,NA,NA,NA,때에,NULL,NA,kai,NA,i,NULL,အခ,NULL,NA,NULL,da,NA,sung,وقتی,raha,gdy,quando,NA,NA,NA,NA,NA,cînd,когда,NA,keď,ko,NULL,NULL,cuando,kad,NA,när,NA,NULL,samantalang,ขณะท,NA,NULL,NA,NA,NA,NA,NULL,NA
b.GEN.46.29,And Joseph made ready his chariot and went up to meet Israel his father to Goshen and presented himself unto him and he fell on his neck and wept on his neck a good while,while,NA,lank,NA,sa,አቅፎትም,NA,زمانا,հեկեկալով,NA,NA,NULL,NA,dugay,NA,NULL,NA,NA,NA,NA,NA,NA,tan,dlouho,længe,NULL,NA,gay,NA,longe,kui,NA,kauan,NULL,NA,NA,NA,NA,NA,NULL,NA,עוד,रह,NULL,ideig,lama,NULL,NULL,NA,くびをかかえて久しく泣いた,NA,NA,NA,얼마동안,amplexus,NA,apsikabinęs,NA,i,NULL,NULL,जब,NA,NULL,lenge,NA,kigena,چون,raha,chwilę,tempo,NA,NA,NA,NA,NA,vreme,NULL,NA,NULL,NULL,nguva,wakhti,tiempo,NULL,NA,länge,NA,NULL,matagal,NULL,NULL,NULL,NA,NA,NA,NA,NULL,NA
b.EXO.33.22,And it shall come to pass while my glory passeth by that I will put thee in a clift of the rock and will cover thee with my hand while I pass by,while,NA,as,NA,ndërsa,NULL,NA,NULL,NULL,NA,NA,когато,NA,samtang,NA,時,NA,NA,NA,NA,NA,NA,NULL,když,da,NULL,NA,NULL,NA,NULL,NA,NA,kun,NULL,NA,NA,NA,NA,NA,οταν,NA,NULL,जब,Dok,mikor,waktu,NULL,NULL,NA,NULL,NA,NA,NA,때에,NULL,NA,NULL,NA,NULL,NULL,အခ,NULL,NA,NULL,når,NA,NULL,چون,raha,NULL,NULL,NA,NA,NA,NA,NA,cînd,когда,NA,keď,ko,NULL,NULL,cuando,NULL,NA,NULL,NA,NULL,samantalang,NULL,NA,NULL,NA,NA,NA,NA,ekudluleni,NA
b.EXO.33.22,And it shall come to pass while my glory passeth by that I will put thee in a clift of the rock and will cover thee with my hand while I pass by,while,NA,as,NA,ndërsa,NULL,NA,NULL,NULL,NA,NA,когато,NA,samtang,NA,時,NA,NA,NA,NA,NA,NA,NULL,když,da,NULL,NA,NULL,NA,NULL,NA,NA,kun,NULL,NA,NA,NA,NA,NA,οταν,NA,NULL,जब,Dok,mikor,waktu,NULL,NULL,NA,NULL,NA,NA,NA,때에,NULL,NA,NULL,NA,NULL,NULL,အခ,NULL,NA,NULL,når,NA,NULL,چون,raha,NULL,NULL,NA,NA,NA,NA,NA,cînd,когда,NA,keď,ko,NULL,NULL,cuando,NULL,NA,NULL,NA,NULL,samantalang,NULL,NA,NULL,NA,NA,NA,NA,ekudluleni,NA
b.EXO.34.29,And it came to pass when Moses came down from mount Sinai with the two tables of testimony in Moses hand when he came down from the mount that Moses wist not that the skin of his face shone while he talked with him,while,NA,omdat,NA,NULL,የፊቱ,NA,NULL,NULL,NA,NA,понеже,NA,NULL,NA,NULL,NA,NA,NA,NA,NA,NA,t,když,NULL,NULL,NA,NULL,NA,pro,NULL,NA,NULL,parce,NA,NA,NA,NA,NA,ενω,NA,NULL,रह,NULL,NULL,NULL,NULL,NULL,NA,NULL,NA,NA,NA,말씀하였음을,NULL,NA,NULL,NA,i,NULL,NULL,रह,NA,gloeide,fordi,NA,sung,NULL,NULL,gdy,NULL,NA,NA,NA,NA,NA,NULL,лучами,NA,skveje,ker,richibwinya,wejigiisu,estado,dokle,NA,hy,NA,డగ,NULL,NULL,NA,RABle,NA,NA,NA,NA,NULL,NA
b.LEV.4.27,And if any one of the common people sin through ignorance while he doeth somewhat against any of the commandments of the LORD concerning things which ought not to be done and be guilty,while,NA,omdat,NA,NULL,NULL,NA,NULL,NA,NA,NA,като,NA,nakabuhat,NA,NULL,NA,NA,NA,NA,NA,NA,NULL,NULL,NULL,NULL,NA,NULL,NA,NULL,NULL,NA,NULL,NULL,NA,NA,NA,NA,NA,NULL,NA,NULL,NULL,NULL,NULL,NULL,NULL,NULL,NA,NULL,NA,NA,NA,NULL,NULL,NA,NULL,NA,mea,NULL,NULL,NULL,NA,NULL,NULL,NA,NULL,NULL,NULL,NULL,NULL,NA,NA,NA,NA,NA,NULL,NULL,NA,NULL,NULL,NULL,NULL,NULL,NULL,NA,därigenom,NA,NULL,NULL,เจตนาค,NA,NULL,NA,NA,NA,NA,NULL,NA
b.LEV.14.46,Moreover he that goeth into the house all the while that it is shut up shall be unclean until the even,while,NA,tyd,NA,kohës,በተዘጋበትም,NA,NULL,NA,NA,NA,време,NA,pa,NA,時,NA,NA,NA,NA,NA,NA,NULL,NULL,længe,solange,NA,daabuyaŋo,NA,tempo,NULL,NA,NULL,temps,NA,NA,NA,NA,NA,καθ,NA,NULL,NULL,dok,míg,NULL,stund,mentre,NA,NULL,NA,NA,NA,동안에,NULL,NA,uždarytus,NA,NULL,असत,NULL,NULL,NA,NULL,tid,NA,sung,روزهایی,NULL,NA,enquanto,NA,NA,NA,NA,NA,timpul,время,NA,kým,dokler,panguva,intuu,tiempo,dok,NA,tid,NA,డగ,NULL,NULL,NA,NULL,NA,NA,NA,NA,imihla,NA
b.LEV.26.43,The land also shall be left of them and shall enjoy her sabbaths while she lieth desolate without them and they shall accept of the punishment of their iniquity because even because they despised my judgments and because their soul abhorred my statutes,while,NA,terwyl,NA,ndërsa,NULL,NA,NULL,NA,NA,NA,NULL,NA,samtang,NA,時,NA,NA,NA,NA,NA,NA,NULL,kdyžto,medens,dieweil,NA,NULL,NA,kiam,NULL,NA,NULL,pendant,NA,NA,NA,NA,NA,NULL,NA,NULL,रह,NULL,míg,NULL,meðan,mentre,NA,彼らが地を離れて地が荒れ果てている間,NA,NA,NA,때에,NULL,NA,kai,NA,i,NULL,စဉ,NULL,NA,terwijl,mens,NA,kihep,چون,raha,NA,sendo,NA,NA,NA,NA,NA,cînd,NULL,NA,kým,NULL,NULL,intuu,estando,kad,NA,NULL,NA,NULL,samantalang,NULL,NA,sürece,NA,NA,NA,NA,xa,NA
b.NUM.11.33,And while the flesh was yet between their teeth ere it was chewed the wrath of the LORD was kindled against the people and the LORD smote the people with a very great plague,while,NA,NULL,NA,akoma,NULL,NA,NULL,NA,NA,NA,като,NA,Samtang,NA,NULL,NA,NA,NA,NA,NA,NA,lè,vězelo,Medens,aber,NA,waato,NA,NULL,NA,NA,NULL,Comme,NA,NA,NA,NA,NA,Ενω,NA,NULL,NULL,NULL,NULL,NULL,Meðan,NULL,NA,NULL,NA,NA,NA,NULL,NULL,NA,NULL,NA,mea,NULL,NULL,NULL,NA,NULL,mens,NA,lai,NULL,raha,NULL,NULL,NA,NA,NA,NA,NA,cînd,NULL,NA,kým,NULL,NULL,intii,NULL,NULL,NA,under,NA,డగ,Samantalang,เม,NA,NULL,NA,NA,NA,NA,NULL,NA
b.NUM.15.32,And while the children of Israel were in the wilderness they found a man that gathered sticks upon the sabbath day,while,NA,toe,NA,Ndërsa,NULL,NA,كان,NA,NA,NA,Когато,NA,samtang,NA,候,NA,NA,NA,NA,NA,NA,antan,když,Medens,NULL,NA,NULL,NA,NULL,NULL,NA,NULL,Comme,NA,NA,NA,NA,NA,οτε,NA,NULL,जब,NULL,NULL,waktu,Meðan,Mentre,NA,NULL,NA,NA,NA,NULL,cum,NA,būnant,NA,i,NULL,အခ,जब,NA,NULL,Mens,NA,lai,چون,raha,gdy,Estando,NA,NA,NA,NA,NA,NULL,NULL,NA,keď,ko,NULL,intii,Estando,kad,NA,Medan,NA,NULL,samantalang,NULL,NA,NULL,NA,NA,NA,NA,NULL,NA
b.NUM.23.15,And he said unto Balak Stand here by thy burnt offering while I meet the LORD yonder,while,NA,NULL,NA,NULL,NULL,NA,NULL,NA,NA,NA,NULL,NA,samtang,NA,等,NA,NA,NA,NA,NA,NA,NULL,půjdu,medens,NULL,NA,NULL,NA,NULL,NULL,NA,NULL,NULL,NA,NA,NA,NA,NA,NULL,NA,עלתך,रह,odoh,égõáldozatod,sementara,meðan,NULL,NA,NULL,NA,NA,NA,동안에,donec,NA,NULL,NA,NULL,NULL,အခ,NULL,NA,NULL,mens,NA,sung,نزدقربانی,NULL,NULL,enquanto,NA,NA,NA,NA,NA,NULL,NULL,NA,kým,pojdem,NULL,NULL,y,NULL,NA,därborta,NA,NULL,samantalang,ขณะท,NA,NULL,NA,NA,NA,NA,ndenjenje,NA
b.NUM.25.11,Phinehas the son of Eleazar the son of Aaron the priest hath turned my wrath away from the children of Israel while he was zealous for my sake among them that I consumed not the children of Israel in my jealousy,while,NA,deurdat,NA,NULL,NULL,NA,بكونه,NA,NA,NA,понеже,NA,niana,NA,NULL,NA,NA,NA,NA,NA,NA,t,kdyžto,idet,NULL,NA,NULL,NA,cxar,NULL,NA,kun,parce,NA,NA,NA,NA,NA,δειξας,NA,NULL,तक,obuzet,NULL,NULL,NULL,NULL,NA,NULL,NA,NA,NA,NULL,NULL,NA,apimtas,NA,i,NULL,NULL,NULL,NA,NA,fordi,NA,NULL,NULL,raha,NULL,NULL,NA,NA,NA,NA,NA,rîvna,NULL,NA,keď,NULL,NULL,NULL,NULL,otvorivši,NA,NULL,NA,NULL,paraang,เราในท,NA,NULL,NA,NA,NA,NA,ekukhweleteni,NA
b.DEU.19.6,Lest the avenger of the blood pursue the slayer while his heart is hot and overtake him because the way is long and slay him whereas he was not worthy of death inasmuch as he hated him not in time past,while,NA,as,NA,ndërsa,NA,NA,يحمى,NA,NA,NA,NULL,NA,samtang,NA,NULL,NA,NA,NA,NA,NA,NA,t,když,NULL,weil,NA,NULL,NA,kiam,NULL,NA,NULL,NULL,NA,NA,NA,NA,NA,ενω,NA,כי,NULL,NULL,NULL,NA,meðan,mentre,NA,NULL,NA,NA,NA,NULL,NULL,NA,NULL,NA,mea,NULL,အခ,NULL,NA,eventuele,NULL,NA,laia,وقتی,raha,NULL,enquanto,NA,NA,NA,NA,NA,NULL,NULL,NA,keď,ko,NULL,intuu,cuando,dok,NA,NULL,NA,డగ,samantalang,NULL,NA,NULL,NA,NA,NA,NA,ishushu,NA
b.DEU.31.27,For I know thy rebellion and thy stiff neck behold while I am yet alive with you this day ye have been rebellious against the LORD and how much more after my death,while,NA,terwyl,NA,kur,ሳለሁ,NA,NULL,NA,NA,NA,догде,NA,samtang,NA,NULL,NA,NA,NA,NA,NA,NA,pandan,když,når,wo,NA,za,NA,kiam,NULL,NA,NULL,pendant,NA,NA,NA,NA,NA,ενω,NA,ערפך,NULL,dok,NULL,Selagi,meðan,mentre,NA,かたくななこととを知っている,NA,NA,NA,NULL,NULL,NA,NULL,NA,i,NULL,စဉ,NULL,NA,NULL,mens,NA,lai,NULL,NULL,NULL,vivendo,NA,NA,NA,NA,NA,cît,когда,NA,kým,ko,NULL,noolahay,estando,dokle,NA,medan,NA,డగ,NULL,เม,NA,NULL,NA,NA,NA,NA,elukhuni,NA
b.JOS.14.10,And now behold the LORD hath kept me alive as he said these forty and five years even since the LORD spake this word unto Moses while the children of Israel wandered in the wilderness and now lo I am this day fourscore and five years old,while,NA,toe,NA,ndërsa,NULL,NA,NULL,NA,NA,NA,когато,NA,panahon,NA,時,NA,NA,NA,NA,NA,NA,Lè,NULL,Tid,NULL,NA,za,NA,dum,NULL,NA,NULL,lorsqu,NA,NA,NA,NA,NA,οτε,NA,NULL,NULL,dok,NULL,ketika,meðan,mentre,NA,NULL,NA,NA,NA,NULL,quando,NA,kai,NA,i,NULL,စဉ,NULL,NA,NULL,tid,NA,sung,وقتی,raha,NULL,tempo,NA,NA,NA,NA,NA,cînd,когда,NA,NULL,ko,panguva,intii,cuando,kad,NA,NULL,NA,NULL,samantalang,เม,NA,NULL,NA,NA,NA,NA,NULL,NA
b.JDG.3.26,And Ehud escaped while they tarried and passed beyond the quarries and escaped unto Seirath,while,NA,terwyl,NA,Ndërsa,NULL,NA,اذ,NA,NA,NA,докато,NA,pa,NA,時,NA,NA,NA,NA,NA,NA,tan,když,medens,dieweil,NA,NULL,NA,dum,NULL,NA,NULL,Pendant,NA,NA,NA,NA,NA,οσω,NA,NULL,जब,NULL,míg,masih,meðan,Mentre,NA,NULL,NA,NA,NA,동안에,dum,NA,kol,NA,i,NULL,စဉ,NULL,NA,NULL,tid,NA,NULL,چون,raha,póki,enquanto,NA,NA,NA,NA,NA,NULL,Пока,NA,kým,ko,NULL,intay,Mientras,dokle,NA,medan,NA,డగ,samantalang,NULL,NA,NULL,NA,NA,NA,NA,NULL,NA
b.JDG.11.26,While Israel dwelt in Heshbon and her towns and in Aroer and her towns and in all the cities that be along by the coasts of Arnon three hundred years why therefore did ye not recover them within that time,While,NA,Terwyl,NA,NULL,NULL,NA,NULL,NA,NA,NA,Триста,NA,Samtang,NA,NULL,NA,NA,NA,NA,NA,NA,NULL,NULL,NULL,Dieweil,NA,NULL,NA,NULL,NA,NA,NULL,NULL,NA,NA,NA,NA,NA,NULL,NA,NULL,NULL,NULL,Míg,NULL,NULL,NULL,NA,イスラエルはヘシボンとその村里に住み,NA,NA,NA,NULL,NULL,NA,NULL,NA,I,NULL,စဉ,NULL,NA,NULL,NULL,NA,NULL,NULL,Raha,NULL,Enquanto,NA,NA,NA,NA,NA,NULL,NULL,NA,Kým,NULL,Nguva,NULL,NULL,NULL,NA,NULL,NA,ల,Samantalang,NULL,NA,NULL,NA,NA,NA,NA,NULL,NA
b.JDG.14.17,And she wept before him the seven days while their feast lasted and it came to pass on the seventh day that he told her because she lay sore upon him and she told the riddle to the children of her people,while,NA,NULL,NA,gjatë,NULL,NA,NULL,NA,NA,NA,NULL,NA,diha,NA,NULL,NA,NA,NA,NA,NA,NA,NULL,NULL,NULL,da,NA,NULL,NA,dum,NA,NA,NULL,pendant,NA,NA,NA,NA,NA,καθ,NA,NULL,तब,NULL,NULL,NULL,barmaði,NULL,NA,NULL,NA,NA,NA,동안에,NULL,NA,kol,NA,NULL,NULL,NULL,NULL,NA,NULL,NULL,NA,sung,NULL,NULL,póki,NULL,NA,NA,NA,NA,NA,timpul,продолжался,NA,NULL,dokler,panguva,intii,NULL,dokle,NA,NULL,NA,NULL,habang,NULL,NA,NULL,NA,NA,NA,NA,NULL,NA
b.JDG.15.1,But it came to pass within a while after in the time of wheat harvest that Samson visited his wife with a kid and he said I will go in to my wife into the chamber But her father would not suffer him to go in,while,NA,tyd,NA,kohe,NULL,NA,NULL,NA,NA,NA,когато,NA,madugay,NA,NULL,NA,NA,NA,NA,NA,NA,NULL,několika,NULL,NULL,NA,kayna,NA,tempo,NULL,NA,nisunleikkuuaikana,temps,NA,NA,NA,NA,NA,καιρον,NA,NULL,NULL,NULL,búzaaratásnak,ketika,NULL,NULL,NA,NULL,NA,NA,NA,얼마,aliquantum,NA,NULL,NA,NULL,NULL,NULL,NULL,NA,poos,NULL,NA,laiin,چندی,kelikely,NULL,dias,NA,NA,NA,NA,NA,cîtva,когда,NA,nejakom,časa,nguva,dabadeed,tiempo,NULL,NA,medan,NA,NULL,sangdaling,NULL,NA,NULL,NA,NA,NA,NA,NULL,NA
b.JDG.16.27,Now the house was full of men and women and all the lords of the Philistines were there and there were upon the roof about three thousand men and women that beheld while Samson made sport,while,NA,hoe,NA,ndërsa,NULL,NA,NULL,NA,NA,NA,NULL,NA,nanan,NA,NULL,NA,NA,NA,NA,NA,NA,t,když,medens,zusahen,NA,waato,NA,NULL,NULL,NA,NULL,NULL,NA,NA,NA,NA,NA,NULL,NA,NULL,रह,NULL,NULL,NULL,er,mentre,NA,また屋根の上には三千人ばかりの男女がいて,NA,NA,NA,NULL,NULL,NA,NULL,NA,ana,NULL,NULL,NULL,NA,nog,NULL,NA,NULL,تماشا,NULL,gdy,NULL,NA,NA,NA,NA,NA,NULL,на,NA,keď,NULL,NULL,intuu,NULL,kako,NA,huru,NA,NULL,samantalang,NULL,NA,NULL,NA,NA,NA,NA,NULL,NA
b.1SA.2.13,And the priests custom with the people was that when any man offered sacrifice the priest s servant came while the flesh was in seething with a fleshhook of three teeth in his hand,while,NA,soos,NA,kur,በተቀቀለ,NA,طبخ,NA,NA,NA,NULL,NA,samtang,NA,時,NA,NA,NA,NA,NA,NA,Antan,když,medens,wenn,NA,za,NA,dum,NA,NA,NULL,arrivait,NA,NA,NA,NA,NA,ενω,NA,כבשל,NULL,dok,midõn,Sementara,meðan,mentre,NA,NULL,NA,NA,NA,때에,dum,NA,NULL,NA,mea,NULL,စဉ,NULL,NA,Terwijl,kokt,NA,laitakin,NULL,raha,NULL,estando,NA,NA,NA,NA,NA,cînd,время,NA,keď,ko,ichibikwa,NULL,mientras,dok,NA,medan,NA,NULL,samantalang,ขณะเม,NA,NA,NA,NA,NA,NA,xa,NA
b.1SA.7.2,And it came to pass while the ark abode in Kirjath jearim that the time was long for it was twenty years and all the house of Israel lamented after the LORD,while,NA,NULL,NA,NULL,NULL,NA,NULL,NA,NA,NA,когато,NA,NULL,NA,NULL,NA,NA,NA,NA,NA,NA,tan,NULL,NULL,da,NA,za,NA,kiam,NULL,NA,NULL,temps,NA,NA,NA,NA,NA,ετεθη,NA,NULL,NULL,NULL,NULL,NULL,er,NULL,NA,NULL,NA,NA,NA,NULL,NULL,NA,kai,NA,i,NULL,စဉ,NULL,NA,NULL,NULL,NA,sung,NULL,nampibebahan,gdy,NULL,NA,NA,NA,NA,NA,cînd,NULL,NA,NULL,ko,NULL,NULL,desde,kad,NA,då,NA,డగ,nang,NULL,NA,süre,NA,NA,NA,NA,NULL,NA
b.1SA.9.27,And as they were going down to the end of the city Samuel said to Saul Bid the servant pass on before us and he passed on but stand thou still a while that I may shew thee the word of God,while,NA,eers,NA,çast,NULL,NA,NULL,NA,NA,NA,малко,NA,Samtang,NA,等,NA,NA,NA,NA,NA,NA,moman,ažť,Øjeblik,NULL,NA,kayna,NA,anoncos,NA,NA,NULL,NULL,NA,NA,NA,NA,NA,ολιγον,NA,NULL,NULL,NULL,NULL,sebentar,NULL,momento,NA,しばらくここに立ちとどまってください,NA,NA,NA,NULL,subsiste,NA,NULL,NA,NULL,NULL,NA,NULL,NA,NA,NULL,NA,NULL,NULL,NULL,pozostaó,NULL,NA,NA,NA,NA,NA,NULL,NULL,NA,chvíľu,NULL,NULL,NULL,poco,malo,NA,NULL,NA,NULL,NULL,านจงหย,NA,döşek,NA,NA,NA,NA,NULL,NA
b.1SA.14.19,And it came to pass while Saul talked unto the priest that the noise that was in the host of the Philistines went on and increased and Saul said unto the priest Withdraw thine hand,while,NA,terwyl,NA,Ndërsa,NULL,NA,بعد,NA,NA,NA,докато,NA,samtang,NA,時,NA,NA,NA,NA,NA,NA,NULL,když,medens,da,NA,za,NA,dum,NULL,NA,NULL,Pendant,NA,NA,NA,NA,NA,ενω,NA,NULL,रह,dok,míg,NULL,meðan,Mentre,NA,NULL,NA,NA,NA,때에,NULL,NA,Kol,NA,i,NULL,စဉ,रह,NA,Terwijl,mens,NA,laitakin,چون,NULL,gdy,estando,NA,NA,NA,NA,NA,cînd,еще,NA,kým,ko,NULL,NULL,mientras,dok,NA,Medan,NA,డగ,samantalang,NULL,NA,NULL,NA,NA,NA,NA,esathetha,NA
b.1SA.20.14,And thou shalt not only while yet I live shew me the kindness of the LORD that I die not,while,NA,as,NA,sa,ዘመን,NA,NULL,NA,NA,NA,докато,NA,NULL,NA,候,NA,NA,NA,NA,NA,NA,lè,NULL,NULL,solange,NA,waati,NA,NULL,NULL,NA,NULL,NULL,NA,NA,NA,NA,NA,ενοσω,NA,NULL,जब,NULL,míg,NULL,NULL,NULL,NA,もしわたしがなお生きながらえているならば,NA,NA,NA,동안에,NULL,NA,NULL,NA,i,NULL,စဉ,NULL,NA,NULL,da,NA,NULL,مادام,raha,NULL,enquanto,NA,NA,NA,NA,NA,NULL,NULL,NA,NULL,dokler,NULL,NULL,NULL,dokle,NA,då,NA,NULL,NULL,NULL,NA,NULL,NA,NA,NA,NA,NULL,NA
b.1SA.22.4,And he brought them before the king of Moab and they dwelt with him all the while that David was in the hold,while,NA,dae,NA,kohën,NULL,NA,اقامة,NA,NA,NA,докато,NA,samtang,NA,多,NA,NA,NA,NA,NA,NA,tan,dny,Tid,solange,NA,NULL,NA,tempon,NULL,NA,aikaa,temps,NA,NA,NA,NA,NA,καιρον,NA,היות,तक,dok,míg,selama,meðan,finché,NA,NULL,NA,NA,NA,동안에,diebus,NA,kol,NA,noho,NULL,NULL,NULL,NA,periode,tid,NA,omlai,روزهایی,NULL,NULL,tempo,NA,NA,NA,NA,NA,timpul,доколе,NA,dokiaľ,dokler,nguva,intii,tiempo,dokle,NA,länge,NA,NULL,panahon,NULL,NA,sürece,NA,NA,NA,NA,NULL,NA
b.1SA.25.7,And now I have heard that thou hast shearers now thy shepherds which were with us we hurt them not neither was there ought missing unto them all the while they were in Carmel,while,NA,dae,NA,gjatë,አልበደልናቸውም,NA,الايام,NA,NA,NA,време,NA,panahon,NA,時,NA,NA,NA,NA,NA,NA,tan,dny,Tid,solange,NA,alwaatey,NA,tempo,NA,NA,NULL,temps,NA,NA,NA,NA,NA,καιρον,NA,NULL,रह,NULL,míg,selama,tíma,finché,NA,NULL,NA,NA,NA,동안에,grege,NA,kol,NA,mea,असत,NULL,जब,NA,NULL,tid,NA,sung,روزهایی,NULL,NULL,tempo,NA,NA,NA,NA,NA,timpul,пребывания,NA,dni,dokler,nguva,intii,tiempo,dokle,NA,tid,NA,లమ,panahon,NULL,NA,sürece,NA,NA,NA,NA,imihla,NA
b.1SA.25.16,They were a wall unto us both by night and day all the while we were with them keeping the sheep,while,NA,dae,NA,kohën,ዘመን,NA,الايام,NA,NA,NA,докато,NA,higayon,NA,時,NA,NA,NA,NA,NA,NA,tan,dokudž,Tid,solange,NA,alwaatey,NA,tempon,NULL,NA,NULL,temps,NA,NA,NA,NA,NA,καιρον,NA,NULL,जब,dok,idõ,selama,tíma,finché,NA,NULL,NA,NA,NA,동안에,NULL,NA,kai,NA,NULL,NULL,NULL,NULL,NA,NA,tid,NA,sung,روزهایی,NULL,śmierci,dias,NA,NA,NA,NA,NA,timpul,когда,NA,dni,dokler,NULL,NULL,días,dokle,NA,tid,NA,NULL,NULL,NULL,NA,korudular,NA,NA,NA,NA,sinawo,NA
b.1SA.27.11,And David saved neither man nor woman alive to bring tidings to Gath saying Lest they should tell on us saying So did David and so will be his manner all the while he dwelleth in the country of the Philistines,while,NA,dae,NA,gjatë,ዘመን,NA,ايام,NA,NA,NA,време,NA,panahon,NA,時,NA,NA,NA,NA,NA,NA,tan,dokudž,Tid,solange,NA,waati,NA,tempo,NULL,NA,aikaa,temps,NA,NA,NA,NA,NA,καθ,NA,הימים,जब,dok,idõ,selama,tíma,finché,NA,われわれのことを告げるであろう,NA,NA,NA,동안에,NULL,NA,laiką,NA,i,NULL,NULL,जब,NA,periode,tid,NA,sung,روزهایی,nanamaimbo,Samuela,dias,NA,NA,NA,NA,NA,timpul,время,NA,dni,dokler,nguva,intuu,tiempo,dokle,NA,tid,NA,లమ,panahon,การขณะท,NA,NULL,NA,NA,NA,NA,imihla,NA
b.2SA.3.6,And it came to pass while there was war between the house of Saul and the house of David that Abner made himself strong for the house of Saul,while,NA,onderwyl,NA,NULL,NULL,NA,NULL,NA,NA,NA,докато,NA,samtang,NA,時,NA,NA,NA,NA,NA,NA,t,když,NULL,NULL,NA,goono,NA,kiam,NULL,NA,kauan,Pendant,NA,NA,NA,NA,NA,NULL,NA,בהיות,तब,Dok,NULL,Sementara,Meðan,NULL,NA,NULL,NA,NA,NA,동안에,cum,NA,NULL,NA,mea,NULL,စဉ,NULL,NA,Terwijl,Mens,NA,sung,NULL,mbola,gdy,Enquanto,NA,NA,NA,NA,NA,timpul,NULL,NA,keď,dokler,kwakati,NULL,mientras,dok,NA,länge,NA,డగ,samantalang,NULL,NA,NULL,NA,NA,NA,NA,kwakubon,NA
b.2SA.3.35,And when all the people came to cause David to eat meat while it was yet day David sware saying So do God to me and more also if I taste bread or ought else till the sun be down,while,NA,terwyl,NA,sa,NULL,NA,NULL,NA,NA,NA,докато,NA,samtang,NA,NULL,NA,NA,NA,NA,NA,NA,pandan,NULL,medens,da,NA,za,NA,dum,NULL,NA,NULL,pendant,NA,NA,NA,NA,NA,ενω,NA,בעוד,NULL,dok,mikor,NULL,meðan,mentre,NA,NULL,NA,NA,NA,NULL,cum,NA,NULL,NA,mea,NULL,NULL,NULL,NA,NULL,mens,NA,NULL,NULL,raha,gdy,sendo,NA,NA,NA,NA,NA,cît,продолжался,NA,kým,dokler,achiri,intii,mientras,dok,NA,under,NA,NULL,samantalang,ดเสวยพระกระยาหารเม,NA,NULL,NA,NA,NA,NA,kusesemini,NA
b.2SA.7.19,And this was yet a small thing in thy sight O Lord GOD but thou hast spoken also of thy servant s house for a great while to come And is this the manner of man O Lord GOD,while,NA,NULL,NA,ardhme,NULL,NA,طويل,NA,NA,NA,бъдеще,NA,panahon,NA,NULL,NA,NA,NA,NA,NA,NA,NULL,NULL,NULL,NULL,NA,NULL,NA,NULL,NULL,NA,asioista,temps,NA,NA,NA,NA,NA,μακρον,NA,NULL,तक,budućnost,NULL,NULL,NULL,NULL,NA,NULL,NA,NA,NA,말씀하실,NULL,NA,tolimoje,NA,NULL,असत,NULL,NULL,NA,NULL,NULL,NA,sung,NULL,mbola,daleki,distantes,NA,NA,NA,NA,NA,binevoieşti,вдаль,NA,NULL,NULL,panguva,wakhti,NULL,NULL,NA,NULL,NA,లమ,nang,นไกลท,NA,NULL,NA,NA,NA,NA,NULL,NA
b.2SA.12.18,And it came to pass on the seventh day that the child died And the servants of David feared to tell him that the child was dead for they said Behold while the child was yet alive we spake unto him and he would not hearken unto our voice how will he then vex himself if we tell him that the child is dead,while,NA,toe,NA,kur,ሳለ,NA,لما,NA,NA,NA,докато,NA,samtang,NA,時,NA,NA,NA,NA,NA,NA,lè,když,låne,da,NA,za,NA,dum,NULL,NA,kun,lorsque,NA,NA,NA,NA,NA,ενω,NA,בהיות,जब,Dok,mikor,NULL,meðan,quando,NA,NULL,NA,NA,NA,때에,cum,NA,NULL,NA,i,असत,စဉ,जब,NA,NULL,Mens,NA,NULL,چون,mbola,póki,sendo,NA,NA,NA,NA,NA,NULL,когда,NA,dokiaľ,ko,NULL,intii,cuando,dok,NA,medan,NA,డగ,samantalang,เม,NA,yaşarken,NA,NA,NA,NA,NULL,NA
b.2SA.12.21,Then said his servants unto him What thing is this that thou hast done thou didst fast and weep for the child while it was alive but when the child was dead thou didst rise and eat bread,while,NA,NULL,NA,akoma,ሳለ,NA,كان,NA,NA,NA,докато,NA,samtang,NA,NULL,NA,NA,NA,NA,NA,NA,NULL,když,endnu,Da,NA,za,NA,dum,NULL,NA,NULL,Tandis,NA,NA,NA,NA,NA,ενω,NA,NULL,रह,Dok,bõjtöltél,masih,Meðan,ancora,NA,NULL,NA,NA,NA,NULL,adhuc,NA,NULL,NA,i,असत,စဉ,NULL,NA,nog,Mens,NA,damlai,وقتی,mbola,póki,NULL,NA,NA,NA,NA,NA,NULL,еще,NA,dokiaľ,ko,NULL,intuu,Mientras,Dok,NA,Medan,NA,డగ,samantalang,NULL,NA,yaşarken,NA,NA,NA,NA,NULL,NA
