sent_id,context,eng,acu,afr,ake,alb,amh,amu,ara,arm,baq,bsn,bul,cak,ceb,cha,chi,chq,chr,chu,cjp,cni,cop,crp,cze,dan,deu,dik,dje,dop,epo,est,ewe,fin,fra,gbi,gla,glv,got,grc,gre,guj,heb,hin,hrv,hun,ind,isl,ita,jak,jap,jiv,kab,kbh,kor,lat,lav,lit,mam,mao,mar,mya,nep,nhg,nld,nor,ojb,pck,pes,plt,pol,por,pot,ppk,quc,quw,rom,rum,rus,shi,slk,slv,sna,som,spa,srp,ssw,swe,syr,tel,tgl,tha,tmh,tur,ukr,usp,wal,wol,xho,zul
b.PSA.39.3,My heart was hot within me while I was musing the fire burned then spake I with my tongue,while,NA,NULL,NA,ndërsa,NULL,NA,جوفي,NA,NA,NA,Докато,NA,Samtang,anae,時,NA,NA,NA,NA,NA,NA,Plis,NULL,mens,wenn,NA,NULL,NA,NULL,NA,NA,NULL,intérieur,NA,NA,NA,NA,NA,ενω,NA,בהגיגי,रह,NULL,NULL,NULL,andvörp,NULL,NA,NULL,NA,NA,NA,때에,NULL,NA,NULL,NA,i,NULL,စဉ,NULL,NA,NULL,NULL,NA,sung,چون,raha,NULL,enquanto,NA,NA,NA,NA,NA,lăuntric,Воспламенилось,NA,nemý,NULL,NULL,intii,NULL,NULL,NA,NULL,NA,డగ,habang,ขณะท,NA,NULL,NA,NA,NA,NA,NULL,NA
b.PSA.42.3,My tears have been my meat day and night while they continually say unto me Where is thy God,while,NA,NULL,NA,ndërsa,NULL,NA,اذ,NA,NA,NA,Като,NA,Samtang,NULL,NULL,NA,NA,NA,NA,NA,NA,NULL,NULL,NULL,weil,NA,goono,NA,NULL,NULL,NA,NULL,Pendant,NA,NA,NA,NA,NA,οταν,NA,באמר,NULL,dok,mikor,NULL,NULL,quando,NA,おまえの神はどこにいるのか,NA,NA,NA,NULL,NULL,NA,kai,NA,i,NULL,NULL,NULL,NA,NULL,når,NA,NULL,چون,NULL,NULL,porquanto,NA,NA,NA,NA,NA,cînd,когда,NA,NULL,ko,NULL,Intay,mientras,kad,NA,ansikte,NA,డగ,Habang,ขณะท,NA,NULL,NA,NA,NA,NA,NULL,NA
b.PSA.42.10,As with a sword in my bones mine enemies reproach me while they say daily unto me Where is thy God,while,NA,Waarom,NA,armive,NULL,NA,NULL,NA,NA,NA,NULL,NA,Samtang,anae,NULL,NA,NA,NA,NA,NA,NA,lè,NULL,når,wenn,NA,NULL,NA,NULL,NULL,NA,NULL,NULL,NA,NA,NA,NA,NA,συντριβουσι,NA,NULL,NULL,dok,NULL,NULL,er,NULL,NA,NULL,NA,NA,NA,NULL,NA,NA,NULL,NA,i,NULL,NULL,रह,NA,NULL,gå,NA,sung,NULL,mbola,smutno,NULL,NA,NA,NA,NA,NA,cînd,когда,NA,NULL,še,NULL,Intay,NULL,NULL,NA,NULL,NA,షణలచ,habang,NULL,NA,NULL,NA,NA,NA,NA,Ngokuthi,NA
b.PSA.49.18,Though while he lived he blessed his soul and men will praise thee when thou doest well to thyself,while,NA,NULL,NA,ndjente,ሳለ,NA,NULL,NA,NA,NA,NULL,NA,buhi,anae,時,NA,NA,NA,NA,NA,NA,t,NULL,NULL,NULL,NA,NULL,NA,dum,NULL,NA,NULL,pendant,NA,NA,NA,NA,NA,NULL,NA,NULL,NULL,NULL,NULL,NULL,meðan,NULL,NA,NULL,NA,NA,NA,NULL,videbas,NA,gyvendamas,NA,i,NULL,စဉ,NULL,NA,NULL,NULL,NA,NULL,NULL,raha,NULL,enquanto,NA,NA,NA,NA,NA,NULL,NULL,NA,NULL,NULL,paupenyu,NULL,NULL,NULL,NA,NULL,NA,లమ,habang,NULL,NA,NULL,NA,NA,NA,NA,NULL,NA
b.PSA.63.4,Thus will I bless thee while I live I will lift up my hands in thy name,while,NA,as,NA,sa,NULL,NA,NULL,NA,NA,NA,докато,NA,samtang,NULL,時,NA,NA,NA,NA,NA,NA,NULL,lepší,NULL,NULL,NA,NULL,NA,gloradus,NULL,NA,NULL,NULL,NA,NA,NA,NA,NA,NULL,NA,בחיי,NULL,NULL,NULL,NULL,meðan,NULL,NA,わたしは生きながらえる間,NA,NA,NA,NULL,NULL,NA,kol,NA,i,NULL,စဉ,NULL,NA,overtreffen,NULL,NA,NULL,NULL,raha,NULL,enquanto,NA,NA,NA,NA,NA,NULL,NULL,NA,NULL,dokler,ndichiri,NULL,NULL,NULL,NA,NULL,NA,NULL,habang,ตราบเท,NA,NULL,NA,NA,NA,NA,NULL,NA
b.PSA.69.3,I am weary of my crying my throat is dried mine eyes fail while I wait for my God,while,NA,NULL,NA,NULL,NULL,NA,NULL,NA,NA,NA,докато,NA,samtang,mientras,NULL,NA,NA,NA,NA,NA,NA,NULL,dna,NULL,NULL,NA,NULL,NA,NULL,NULL,NA,NULL,tandis,NA,NA,NA,NA,NA,NULL,NA,NULL,रह,NULL,NULL,NULL,NULL,onda,NA,NULL,NA,NA,NA,NULL,NULL,NA,NULL,NA,NULL,NULL,NULL,रह,NA,NULL,NULL,NA,NULL,NULL,raha,NULL,NULL,NA,NA,NA,NA,NA,NULL,NULL,NA,Vošiel,ko,NULL,intii,NULL,NULL,NA,NULL,NA,NULL,habang,NULL,NA,NULL,NA,NA,NA,NA,NULL,NA
b.PSA.78.30,They were not estranged from their lust But while their meat was yet in their mouths,while,NA,NULL,NA,NULL,ሳለ,NA,NULL,NA,NA,NA,докато,NA,NULL,NULL,候,NA,NA,NA,NA,NA,NA,NULL,ještě,mens,gebüßt,NA,NULL,NA,kiam,NULL,NA,NULL,NULL,NA,NA,NA,NA,NA,NULL,NA,NULL,रह,pohlepu,NULL,sementara,meðan,ancora,NA,NULL,NA,NA,NA,NULL,NA,NA,dar,NA,NULL,NULL,စဉ,NULL,NA,Terwijl,lystet,NA,NULL,نکشیدند,mbola,gdy,NULL,NA,NA,NA,NA,NA,stîmpere,еще,NA,kým,NULL,kukara,xiisa,estando,NULL,NA,NULL,NA,డగ,NULL,ขณะท,NA,NULL,NA,NA,NA,NA,enkanukweni,NA
b.PSA.88.15,I am afflicted and ready to die from my youth up while I suffer thy terrors I am distracted,while,NA,NULL,NA,NULL,NULL,NA,NULL,NA,NA,NA,NULL,NA,Samtang,mientras,NULL,NA,NA,NA,NA,NA,NA,NULL,NULL,NULL,NULL,NA,NULL,NA,NULL,NA,NA,peität,NULL,NA,NA,NA,NA,NA,NULL,NA,אמיך,NULL,NULL,NULL,NULL,NULL,NULL,NA,NULL,NA,NA,NA,NULL,NULL,NA,NULL,NA,i,NULL,NULL,NULL,NA,NULL,skjuler,NA,NULL,NULL,fahazazako,NULL,NULL,NA,NA,NA,NA,NA,NULL,NULL,NA,NULL,NULL,NULL,riddayna,infancia,NULL,NA,NULL,NA,NULL,habang,ขณะข,NA,NULL,NA,NA,NA,NA,NULL,NA
b.PSA.104.33,I will sing unto the LORD as long as I live I will sing praise to my God while I have my being,while,NA,solank,NA,sa,ሳለሁ,NA,لالهي,NA,NA,NA,докле,NA,samtang,mientras,時,NA,NA,NA,NA,NA,NA,pandan,pokudž,Tid,solange,NA,NULL,NA,dum,NULL,NA,ikäni,tant,NA,NA,NA,NA,NA,ενοσω,NA,בחיי,NULL,NULL,míg,selama,NULL,finché,NA,NULL,NA,NA,NA,NULL,NULL,NA,kol,NA,i,NULL,NULL,रह,NA,NULL,lenge,NA,NULL,NULL,mbola,póki,enquanto,NA,NA,NA,NA,NA,cît,доколе,NA,kým,dokler,NULL,noolahay,NULL,dok,NA,länge,NA,తక,samantalang,ขณะข,NA,NULL,NA,NA,NA,NA,NULL,NA
b.PSA.146.2,While I live will I praise the LORD I will sing praises unto my God while I have any being,While,NA,NULL,NA,NULL,NULL,NA,NULL,NA,NA,NA,NULL,NA,Samtang,Mientras,NULL,NA,NA,NA,NA,NA,NA,NULL,Chváliti,NULL,NULL,NA,NULL,NA,NULL,NULL,NA,NULL,NULL,NA,NA,NA,NA,NA,NULL,NA,NULL,NULL,NULL,NULL,NULL,NULL,NULL,NA,NULL,NA,NA,NA,NULL,aedificans,NA,NULL,NA,I,म,NULL,NULL,NA,NULL,lenge,NA,NULL,NULL,NULL,Chwal,NULL,NA,NA,NA,NA,NA,NULL,доколе,NA,kým,NULL,NULL,Intaan,Alabaré,NULL,NA,länge,NA,NULL,Samantalang,NULL,NA,NULL,NA,NA,NA,NA,NULL,NA
b.PSA.146.2,While I live will I praise the LORD I will sing praises unto my God while I have any being,while,NA,as,NA,sa,ዘመን,NA,لالهي,NA,NA,NA,докато,NA,samtang,mientras,時,NA,NA,NA,NA,NA,NA,tan,dokud,længe,solange,NA,NULL,NA,longe,NULL,NA,kauan,tant,NA,NA,NA,NA,NA,ενοσω,NA,בחיי,रह,Dok,míg,selama,meðan,finché,NA,NULL,NA,NA,NA,생전에,NULL,NA,kol,NA,NULL,NULL,စဉ,NULL,NA,zolang,lenge,NA,laitengin,مادامی,mbola,póki,enquanto,NA,NA,NA,NA,NA,cît,доколе,NA,dokiaľ,dokler,NULL,NULL,mientras,dok,NA,länge,NA,NULL,samantalang,ตราบเท,NA,NULL,NA,NA,NA,NA,NULL,NA
b.PRO.8.26,While as yet he had not made the earth nor the fields nor the highest part of the dust of the world,While,NA,NULL,NA,NULL,NULL,NA,NULL,NA,NA,NA,Докато,NA,Samtang,NA,NULL,NA,NA,NA,NA,NA,NA,NULL,NULL,NULL,NULL,NA,Za,NA,NULL,NULL,NA,NULL,NULL,NA,NA,NA,NA,NA,NULL,NA,NULL,NULL,NULL,Mikor,NULL,áður,Quando,NA,NULL,NA,NA,NA,NULL,NULL,NA,NULL,NA,I,म,NULL,NULL,NA,aarde,NULL,NA,NULL,NULL,Fony,NULL,NULL,NA,NA,NA,NA,NA,NULL,NULL,NA,kým,NULL,NULL,Intaanuu,NULL,NULL,NA,NULL,NA,NULL,Samantalang,NULL,NA,NA,NA,NA,NA,NA,NULL,NA
b.PRO.19.18,Chasten thy son while there is hope and let not thy soul spare for his crying,while,NA,want,NA,sa,NULL,NA,NULL,NA,NA,NA,докато,NA,natan,NA,趁,NA,NA,NA,NA,NA,NA,lè,dokudž,imens,solange,NA,za,NA,dum,NULL,NA,kun,NULL,NA,NA,NA,NA,NA,ενοσω,NA,כי,NULL,dok,mert,selama,NULL,finché,NA,NULL,NA,NA,NA,NULL,NULL,NA,kol,NA,mea,NULL,စဉ,NULL,NA,zolang,NULL,NA,laiin,NULL,mbola,póki,enquanto,NA,NA,NA,NA,NA,NULL,доколе,NA,kým,dokler,NULL,intay,mientras,dokle,NA,medan,NA,NULL,dangang,สอนบ,NA,varken,NA,NA,NA,NA,xa,NA
b.PRO.31.15,She riseth also while it is yet night and giveth meat to her household and a portion to her maidens,while,NA,as,NA,NULL,ሳለ,NA,اذ,NA,NA,NA,докле,NA,samtang,NA,NULL,NA,NA,NA,NA,NA,NA,tan,NULL,NULL,NULL,NA,NULL,NA,kiam,NULL,NA,NULL,lorsqu,NA,NA,NA,NA,NA,ενω,NA,בעוד,NULL,NULL,NULL,NULL,NULL,quando,NA,NULL,NA,NA,NA,NULL,NULL,NA,NULL,NA,mea,NULL,NULL,NULL,NA,vroege,mens,NA,lai,وقتی,raha,wstaje,quando,NA,NA,NA,NA,NA,cînd,NULL,NA,NULL,ko,huchiri,NULL,siendo,dok,NA,Medan,NA,NULL,samantalang,NULL,NA,NULL,NA,NA,NA,NA,NULL,NA
b.ECC.9.3,This is an evil among all things that are done under the sun that there is one event unto all yea also the heart of the sons of men is full of evil and madness is in their heart while they live and after that they go to the dead,while,NA,gedurende,NA,sa,NULL,NA,وهم,NA,NA,NA,докато,NA,samtang,NA,時,NA,NA,NA,NA,NA,NA,NULL,pokudž,NULL,dieweil,NA,Kokor,NA,dum,NA,NA,NULL,pendant,NA,NA,NA,NA,NA,ενοσω,NA,NULL,जब,dok,NULL,NULL,NULL,mentre,NA,NULL,NA,NA,NA,품다가,NULL,NA,kol,NA,i,ईटच,စဉ,NULL,NA,NULL,lenge,NA,lai,مادامی,NULL,NULL,durante,NA,NA,NA,NA,NA,timpul,NULL,NA,kým,dokler,vachiri,intay,mientras,dok,NA,länge,NA,లమ,habang,NULL,NA,sürece,NA,NA,NA,NA,besadla,NA
b.ECC.12.1,Remember now thy Creator in the days of thy youth while the evil days come not nor the years draw nigh when thou shalt say I have no pleasure in them,while,NA,voordat,NA,NULL,NULL,NA,NULL,NA,NA,NA,NULL,NA,pa,NA,尚,NA,NA,NA,NA,NA,NA,NULL,NULL,NULL,NULL,NA,NULL,NA,dum,NULL,NA,NULL,avant,NA,NA,NA,NA,NA,NULL,NA,NULL,NULL,NULL,téged,NULL,áður,NULL,NA,NULL,NA,NA,NA,NULL,NULL,NA,kol,NA,mea,NULL,စဉ,NULL,NA,voordat,NULL,NA,NULL,NULL,dieny,nastaną,NULL,NA,NA,NA,NA,NA,pînă,доколе,NA,kým,preden,NULL,dhallinyaranimadaada,NULL,NULL,NA,NULL,NA,NULL,NULL,NULL,NA,NULL,NA,NA,NA,NA,NULL,NA
b.ECC.12.2,While the sun or the light or the moon or the stars be not darkened nor the clouds return after the rain,While,NA,voordat,NA,NULL,NULL,NA,NULL,NA,NA,NA,NULL,NA,NULL,NA,NULL,NA,NA,NA,NA,NA,NA,NULL,NULL,NULL,NULL,NA,NULL,NA,NULL,NULL,NA,NULL,NULL,NA,NA,NA,NA,NA,σκοτισθη,NA,NULL,NULL,NULL,Vesd,NULL,áður,NULL,NA,NULL,NA,NA,NA,NULL,tenebrescat,NA,Nelauk,NA,I,त,NULL,यसभन,NA,denken,NULL,NA,NULL,NULL,NULL,NULL,NULL,NA,NA,NA,NA,NA,NULL,доколе,NA,kým,NULL,NULL,NULL,NULL,Pre,NA,NULL,NA,ల,Bago,NULL,NA,NA,NA,NA,NA,NA,lingekabi,NA
b.SON.1.12,While the king sitteth at his table my spikenard sendeth forth the smell thereof,While,NA,NULL,NA,Ndërsa,NULL,NA,NULL,NA,NA,NA,Докато,NA,Samtang,NA,NULL,NA,NA,NA,NA,NA,NA,NULL,Dotud,NULL,Da,NA,NULL,NA,Dum,NULL,NA,NULL,Tandis,NA,NA,NA,NA,NA,Ενοσω,NA,NULL,जब,Dok,Mikor,Sementara,Meðan,Mentre,NA,NULL,NA,NA,NA,NULL,fasciculus,NA,NULL,NA,I,NULL,စဉ,NULL,NA,Zolang,lenge,NA,NULL,NULL,Raha,Dotąd,Enquanto,NA,NA,NA,NA,NA,NULL,Мирровый,NA,Dokiaľ,Dokler,Nguva,NULL,NULL,Dok,NA,Medan,NA,NULL,Samantalang,NULL,NA,NULL,NA,NA,NA,NA,NULL,NA
b.ISA.10.25,For yet a very little while and the indignation shall cease and mine anger in their destruction,while,NA,rukkie,NA,kohë,NULL,NA,NULL,NA,NA,NA,NULL,NA,madugay,NA,時,NA,NA,NA,NA,NA,NA,Talè,dokoná,Stund,NULL,NA,cindi,NA,dauxros,NULL,NA,NULL,temps,NA,NA,NA,NA,NA,NULL,NA,מזער,NULL,malo,idõ,NULL,er,poco,NA,ただしばらくして,NA,NA,NA,불구에,modicumque,NA,valandėlė,NA,NULL,NULL,ခဏက,NULL,NA,NULL,stund,NA,Sawtlou,NULL,NULL,NULL,cumprirá,NA,NA,NA,NA,NA,vreme,немного,NA,máličko,časa,chiduku,wakhti,tiempo,NULL,NA,tid,NA,NULL,pa,NULL,NA,NULL,NA,NA,NA,NA,mzuzwana,NA
b.ISA.28.4,And the glorious beauty which is on the head of the fat valley shall be a fading flower and as the hasty fruit before the summer which when he that looketh upon it seeth while it is yet in his hand he eateth it up,while,NA,terwyl,NA,NULL,NULL,NA,NULL,NA,NA,NA,NULL,NA,samtang,NA,NULL,NA,NA,NA,NA,NA,NA,NULL,NULL,NULL,ersieht,NA,za,NA,englutas,NA,NA,tuskin,NULL,NA,NA,NA,NA,NA,NULL,NA,בעודה,NULL,NULL,NULL,NULL,NULL,NULL,NA,NULL,NA,NA,NA,NULL,cum,NA,NULL,NA,mea,NULL,NULL,जब,NA,weggeplukt,mens,NA,NULL,NULL,raha,NULL,NULL,NA,NA,NA,NA,NA,NULL,NULL,NA,kým,NULL,NULL,intuu,NULL,NULL,NA,medan,NA,తక,samantalang,ยพอถ,NA,NULL,NA,NA,NA,NA,NULL,NA
b.ISA.29.17,Is it not yet a very little while and Lebanon shall be turned into a fruitful field and the fruitful field shall be esteemed as a forest,while,NA,rukkie,NA,NULL,ዘመን,NA,يسيرة,NA,NA,NA,време,NA,panahon,NA,時,NA,NA,NA,NA,NA,NA,NULL,kratičkém,Stund,NULL,NA,NULL,NA,tempo,NULL,NA,NULL,temps,NA,NA,NA,NA,NA,καιρος,NA,מזער,NULL,naskoro,idõ,lama,NULL,NULL,NA,NULL,NA,NA,NA,NULL,brevi,NA,Netrukus,NA,NULL,NULL,NULL,NULL,NA,NULL,stund,NA,Sawtlou,زمانی,NULL,króciuchnym,tempo,NA,NA,NA,NA,NA,vreme,NULL,NA,málo,časa,NULL,intay,tiempo,doskora,NA,tid,NA,లమ,lamang,NULL,NA,NULL,NA,NA,NA,NA,umzuzwana,NA
b.ISA.55.6,Seek ye the LORD while he may be found call ye upon him while he is near,while,NA,terwyl,NA,ndërsa,NULL,NA,دام,NA,NA,NA,докле,NA,samtang,NA,候,NA,NA,NA,NA,NA,NA,pandan,pokudž,medens,solange,NA,za,NA,dum,NULL,NA,kun,pendant,NA,NA,NA,NA,NA,ενοσω,NA,NULL,जब,dok,míg,selama,meðan,mentre,NA,NULL,NA,NA,NA,때에,dum,NA,kol,NA,NULL,NULL,NULL,NULL,NA,zolang,mens,NA,laiin,مادامی,dieny,póki,enquanto,NA,NA,NA,NA,NA,cîtă,когда,NA,dokiaľ,dokler,NULL,NULL,mientras,dok,NA,medan,NA,డగ,samantalang,อจะพบพระองค,NA,varken,NA,NA,NA,NA,NULL,NA
b.ISA.55.6,Seek ye the LORD while he may be found call ye upon him while he is near,while,NA,terwyl,NA,ndërsa,NULL,NA,دام,NA,NA,NA,докле,NA,samtang,NA,候,NA,NA,NA,NA,NA,NA,pandan,pokudž,medens,solange,NA,za,NA,dum,NULL,NA,kun,pendant,NA,NA,NA,NA,NA,ενοσω,NA,NULL,जब,dok,míg,selama,meðan,mentre,NA,NULL,NA,NA,NA,때에,dum,NA,kol,NA,NULL,NULL,NULL,NULL,NA,zolang,mens,NA,laiin,مادامی,dieny,póki,enquanto,NA,NA,NA,NA,NA,cîtă,когда,NA,dokiaľ,dokler,NULL,NULL,mientras,dok,NA,medan,NA,డగ,samantalang,อจะพบพระองค,NA,varken,NA,NA,NA,NA,NULL,NA
b.ISA.63.18,The people of thy holiness have possessed it but a little while our adversaries have trodden down thy sanctuary,while,NA,rukkie,NA,NULL,ጥቂት,NA,NULL,NA,NA,NA,NULL,NA,panahon,NA,時,NA,NA,NA,NA,NA,NA,tan,NULL,NULL,NULL,NA,kayna,NA,NULL,NULL,NA,aikaa,temps,NA,NA,NA,NA,NA,NULL,NA,למצער,रह,NULL,NULL,NULL,stund,NULL,NA,NULL,NA,NA,NA,차지한지,NULL,NA,NULL,NA,NULL,NULL,ခဏသ,NULL,NA,NULL,stund,NA,hondouten,زمانی,NULL,NULL,tempo,NA,NA,NA,NA,NA,vreme,NULL,NA,čas,časa,hayo,NULL,tiempo,NULL,NA,NULL,NA,లమ,sangdali,NULL,NA,süre,NA,NA,NA,NA,umzuzwana,NA
b.ISA.65.24,And it shall come to pass that before they call I will answer and while they are yet speaking I will hear,while,NA,terwyl,NA,NULL,ገናም,NA,وفيما,NA,NA,NA,докато,NA,samtang,NA,時,NA,NA,NA,NA,NA,NA,tan,NULL,mens,wenn,NA,NULL,NA,NULL,NULL,NA,NULL,Avant,NA,NA,NA,NA,NA,ενω,NA,עוד,NULL,NULL,NULL,NULL,áður,mentre,NA,NULL,NA,NA,NA,NULL,NULL,NA,NULL,NA,i,NULL,စဉ,NULL,NA,Terwijl,mens,NA,NULL,NULL,NULL,NULL,estando,NA,NA,NA,NA,NA,NULL,NULL,NA,kým,ko,NULL,intay,mientras,NULL,NA,medan,NA,డగ,samantalang,ขณะท,NA,yakarmadan,NA,NA,NA,NA,besathetha,NA
b.JER.13.16,Give glory to the LORD your God before he cause darkness and before your feet stumble upon the dark mountains and while ye look for light he turn it into the shadow of death and make it gross darkness,while,NA,terwyl,NA,ndërsa,NULL,NA,NULL,NA,NA,NA,NULL,NA,samtang,NA,NULL,NA,NA,NA,NA,NA,NA,t,čekali,NULL,NULL,NA,NULL,NA,tiam,NULL,NA,hämärissä,NULL,NA,NA,NA,NA,NA,ενω,NA,ובטרם,जब,NULL,NULL,NULL,NULL,NULL,NA,主に栄光を帰せよ,NA,NA,NA,NULL,caligosos,NA,esančius,NA,mea,NULL,အခ,रह,NA,ondoordringbare,NULL,NA,lai,چون,raha,NULL,NULL,NA,NA,NA,NA,NA,nopţii,еще,NA,Lebo,ko,NULL,intaad,NULL,dokle,NA,när,NA,డగ,habang,แสงโพล,NA,Ayaklarınız,NA,NA,NA,NA,NULL,NA
b.JER.15.9,She that hath borne seven languisheth she hath given up the ghost her sun is gone down while it was yet day she hath been ashamed and confounded and the residue of them will I deliver to the sword before their enemies saith the LORD,while,NA,terwyl,NA,ndërsa,ሳለ,NA,اذ,NA,NA,NA,когато,NA,samtang,NA,NULL,NA,NA,NA,NA,NA,NA,NULL,NULL,NULL,NULL,NA,za,NA,kiam,NULL,NA,NULL,quand,NA,NA,NA,NA,NA,ενω,NA,NULL,रह,NULL,mikor,masih,áður,quando,NA,NULL,NA,NA,NA,NULL,cum,NA,NULL,NA,mea,असत,NULL,रह,NA,NULL,mens,NA,laiin,هنوز,NULL,NULL,sendo,NA,NA,NA,NA,NA,cînd,NULL,NA,kým,ko,achiri,Gabbalkeediina,siendo,NULL,NA,medan,NA,NULL,nang,NULL,NA,gündüzken,NA,NA,NA,NA,kusesemini,NA
b.JER.33.1,Moreover the word of the LORD came unto Jeremiah the second time while he was yet shut up in the court of the prison saying,while,NA,terwyl,NA,ndërsa,ሳለ,NA,وهو,NA,NA,NA,като,NA,samtang,NA,NULL,NA,NA,NA,NA,NA,NA,NULL,když,medens,da,NA,NULL,NA,kiam,NULL,NA,kun,pendant,NA,NA,NA,NA,NA,ενω,NA,NULL,NULL,Dok,mikor,masih,er,mentre,NA,NULL,NA,NA,NA,갇혔을,cum,NA,kai,NA,NULL,NULL,အခ,NULL,NA,NULL,mens,NA,NULL,NULL,raha,gdy,estando,NA,NA,NA,NA,NA,cînd,когда,NA,kým,ko,NULL,intuu,estando,dok,NA,medan,NA,డగ,samantalang,เม,NA,tutukluyken,NA,NA,NA,NA,NULL,NA
b.JER.39.15,Now the word of the LORD came unto Jeremiah while he was shut up in the court of the prison saying,while,NA,terwyl,NA,kur,ሳለ,NA,اذ,NA,NA,NA,когато,NA,pa,NA,時,NA,NA,NA,NA,NA,NA,NULL,když,NULL,als,NA,waato,NA,kiam,NULL,NA,ollessaan,pendant,NA,NA,NA,NA,NA,ενω,NA,בהיתו,NULL,Dok,mikor,masih,Meðan,quando,NA,NULL,NA,NA,NA,NULL,cum,NA,NULL,NA,i,असत,NULL,जब,NA,nog,da,NA,laiin,هنوز,mbola,gdy,estando,NA,NA,NA,NA,NA,cînd,когда,NA,keď,ko,panguva,intuu,cuando,kad,NA,medan,NA,డగ,samantalang,ขณะท,NA,tutukluyken,NA,NA,NA,NA,NULL,NA
b.JER.40.5,Now while he was not yet gone back he said Go back also to Gedaliah the son of Ahikam the son of Shaphan whom the king of Babylon hath made governor over the cities of Judah and dwell with him among the people or go wheresoever it seemeth convenient unto thee to go So the captain of the guard gave him victuals and a reward and let him go,while,NA,toe,NA,NULL,NULL,NA,NULL,NA,NA,NA,като,NA,pa,NA,NULL,NA,NA,NA,NA,NA,NA,NULL,NULL,da,NULL,NA,NULL,NA,Dum,NA,NA,kun,comme,NA,NA,NA,NA,NA,NULL,NA,NULL,NULL,NULL,NULL,NULL,NULL,NULL,NA,バビロンの王がユダの町々の総督として立てたシャパンの子アヒカムの子であるゲダリヤの所へ帰り,NA,NA,NA,NULL,mecum,NA,NULL,NA,i,NULL,NULL,NULL,NA,NULL,da,NA,NULL,وقتی,raha,ponieważ,NULL,NA,NA,NA,NA,NA,NULL,NULL,NA,keď,NULL,wakati,intuusan,NULL,kad,NA,då,NA,లమ,Samantala,ขณะเม,NA,NULL,NA,NA,NA,NA,Uthe,NA
b.JER.51.33,For thus saith the LORD of hosts the God of Israel The daughter of Babylon is like a threshingfloor it is time to thresh her yet a little while and the time of her harvest shall come,while,NA,rukkie,NA,NULL,NULL,NA,NULL,NA,NA,NA,NULL,NA,panahon,NA,時,NA,NA,NA,NA,NA,NA,NULL,NULL,Stund,NULL,NA,NULL,NA,dum,NULL,NA,aikaa,Encore,NA,NA,NA,NA,NA,NULL,NA,ובאה,NULL,NULL,híja,NULL,skamms,NULL,NA,NULL,NA,NA,NA,NULL,NULL,NA,valandėlė,NA,NULL,NULL,NULL,NULL,NA,NULL,stund,NA,lai,زمانی,mbola,NULL,NULL,NA,NA,NA,NA,NA,cînd,NULL,NA,málo,ko,nguva,NULL,NULL,NULL,NA,tid,NA,తక,lamang,เวลาเก,NA,süre,NA,NA,NA,NA,ngumzuzwana,NA
b.LAM.1.19,I called for my lovers but they deceived me my priests and mine elders gave up the ghost in the city while they sought their meat to relieve their souls,while,NA,beswyk,NA,ndërsa,ሲፈልጉ,NA,اذ,NA,NA,NA,Когато,NA,Samtang,NA,時,NA,NA,NA,NA,NA,NA,pandan,pomřeli,NULL,verschmachtet,NA,waato,NA,NULL,NULL,NA,kun,NULL,NA,NA,NA,NA,NA,NULL,NA,כי,NULL,NULL,mikor,Ketika,er,mentre,NA,NULL,NA,NA,NA,NULL,consumpti,NA,nerasdami,NA,i,NULL,စဉ,NULL,NA,NULL,da,NA,NULL,NULL,NULL,zginęli,enquanto,NA,NA,NA,NA,NA,NULL,ища,NA,keď,ko,panguva,Intay,aunque,tražeći,NA,medan,NA,NULL,habang,ขณะเม,NA,Kâhinlerimle,NA,NA,NA,NA,NULL,NA
b.EZE.9.8,And it came to pass while they were slaying them and I was left that I fell upon my face and cried and said Ah Lord GOD wilt thou destroy all the residue of Israel in thy pouring out of thy fury upon Jerusalem,while,NA,toe,NA,Ndërsa,ሳለሁ,NA,بينما,NA,NA,NA,NULL,NA,samtang,NA,候,NA,NA,NA,NA,NA,NA,NULL,když,medens,NULL,NA,za,NA,NULL,NA,NA,kun,Comme,NA,NA,NA,NA,NA,NULL,NA,כהכותם,जब,Dok,levágák,masih,Meðan,Mentre,NA,NULL,NA,NA,NA,때에,NULL,NA,NULL,NA,NULL,असत,စဉ,जब,NA,Terwijl,mens,NA,lai,NULL,raha,gdy,enquanto,NA,NA,NA,NA,NA,cînd,когда,NA,keď,ko,NULL,intay,mientras,kad,NA,när,NA,NULL,habang,อมาขณะท,NA,NULL,NA,NA,NA,NA,xa,NA
b.DAN.4.31,While the word was in the king s mouth there fell a voice from heaven saying O king Nebuchadnezzar to thee it is spoken The kingdom is departed from thee,While,NA,Terwyl,NA,NULL,NULL,NA,NULL,NA,NA,NA,NULL,NA,NULL,NA,NULL,NA,NA,NA,NA,NA,NA,NULL,Při,NULL,NULL,NA,NULL,NA,NULL,NULL,NA,hallitus,NULL,NA,NA,NA,NA,NA,Ο,NA,NULL,NULL,NULL,NULL,ketika,Áður,NULL,NA,NULL,NA,NA,NA,NULL,igitur,NA,NULL,NA,I,NULL,NULL,NULL,NA,NULL,NULL,NA,NULL,هنوز,fara,A,NULL,NA,NA,NA,NA,NA,NULL,NULL,NA,pokolenia,NULL,NULL,Intii,NULL,NULL,NA,NULL,NA,NULL,Samantalang,สย,NA,bitirmeden,NA,NA,NA,NA,NULL,NA
b.HOS.1.4,And the LORD said unto him Call his name Jezreel for yet a little while and I will avenge the blood of Jezreel upon the house of Jehu and will cause to cease the kingdom of the house of Israel,while,NA,tydjie,NA,kohe,ዘመን,NA,NULL,NA,NA,NA,NULL,NA,panahon,NA,時,NA,NA,NA,NA,NA,NA,talè,malém,Stund,NULL,NA,NULL,NA,NULL,NULL,NA,aikaa,temps,NA,NA,NA,NA,NA,NULL,NA,NULL,NULL,NULL,idõ,lama,skamms,NULL,NA,NULL,NA,NA,NA,이스르엘이라,NULL,NA,NULL,NA,mea,NULL,ခဏက,NULL,NA,NULL,stund,NA,sawtlou,زمانی,NULL,NULL,NULL,NA,NA,NA,NA,NA,vreme,пройдет,NA,málo,časa,chiduku,dabadeed,NULL,NULL,NA,tid,NA,తక,pa,วานของเยฮ,NA,NULL,NA,NA,NA,NA,NULL,NA
b.NAH.1.10,For while they be folden together as thorns and while they are drunken as drunkards they shall be devoured as stubble fully dry,while,NA,NULL,NA,NULL,NULL,NA,NULL,NA,NA,NA,сплетени,NA,NULL,NA,NULL,NA,NA,NA,NA,NA,NA,NULL,NULL,NULL,wenn,NA,waati,NA,NULL,NA,NA,NULL,NULL,NA,NA,NA,NA,NA,ενω,NA,NULL,NULL,trnovita,NULL,NULL,NULL,NULL,NA,NULL,NA,NA,NA,NULL,NULL,NA,NULL,NA,mea,NULL,အခ,NULL,NA,NULL,NULL,NA,NULL,NULL,NULL,NULL,ainda,NA,NA,NA,NA,NA,NULL,NULL,NA,NULL,NULL,NULL,NULL,NULL,NULL,NA,NULL,NA,NULL,yamang,NULL,NA,NULL,NA,NA,NA,NA,bofanelana,NA
b.NAH.1.10,For while they be folden together as thorns and while they are drunken as drunkards they shall be devoured as stubble fully dry,while,NA,NULL,NA,NULL,NULL,NA,NULL,NA,NA,NA,сплетени,NA,NULL,NA,NULL,NA,NA,NA,NA,NA,NA,NULL,NULL,NULL,wenn,NA,waati,NA,NULL,NA,NA,NULL,NULL,NA,NA,NA,NA,NA,ενω,NA,NULL,NULL,trnovita,NULL,NULL,NULL,NULL,NA,NULL,NA,NA,NA,NULL,NULL,NA,NULL,NA,mea,NULL,အခ,NULL,NA,NULL,NULL,NA,NULL,NULL,NULL,NULL,ainda,NA,NA,NA,NA,NA,NULL,NULL,NA,NULL,NULL,NULL,NULL,NULL,NULL,NA,NULL,NA,NULL,yamang,NULL,NA,NULL,NA,NA,NA,NA,bofanelana,NA
b.HAG.2.6,For thus saith the LORD of hosts Yet once it is a little while and I will shake the heavens and the earth and the sea and the dry land,while,NA,tydjie,NA,NULL,ገና,NA,بعد,NA,NA,NA,NULL,NA,panahon,NA,時,NA,NA,NA,NA,NA,NA,NULL,když,Stund,NULL,NA,NULL,NA,temo,NULL,NA,aikaa,temps,NA,NA,NA,NA,NA,NULL,NA,NULL,NULL,NULL,idõ,waktu,hríð,tempo,NA,しばらくして,NA,NA,NA,있으면,cum,NA,Netrukus,NA,mea,NULL,NULL,NULL,NA,NULL,stund,NA,kalin,زمانی,NULL,jeszcze,NULL,NA,NA,NA,NA,NA,vreme,NULL,NA,NULL,časa,chiduku,wakhti,NULL,NULL,NA,när,NA,తక,panahon,NULL,NA,Kısa,NA,NA,NA,NA,umzuzwana,NA
b.ZEC.14.12,And this shall be the plague wherewith the LORD will smite all the people that have fought against Jerusalem Their flesh shall consume away while they stand upon their feet and their eyes shall consume away in their holes and their tongue shall consume away in their mouth,while,NA,terwyl,NA,ndërsa,NULL,NA,وهم,NA,NA,NA,докато,NA,samtang,NA,時,NA,NA,NA,NA,NA,NA,Grenn,NULL,NULL,dieweil,NA,za,NA,kiam,NULL,NA,kun,tandis,NA,NA,NA,NA,NA,ενω,NA,NULL,NULL,dok,míg,sementara,meðan,mentre,NA,NULL,NA,NA,NA,때에,NULL,NA,dar,NA,mea,NULL,NULL,NULL,NA,NULL,mens,NA,lai,حالتی,NULL,NULL,estando,NA,NA,NA,NA,NA,încă,еще,NA,kým,ko,NULL,NULL,estando,dok,NA,medan,NA,NULL,samantalang,อเขาย,NA,NULL,NA,NA,NA,NA,NULL,NA
b.MAT.1.20,But while he thought on these things behold the angel of the Lord appeared unto him in a dream saying Joseph thou son of David fear not to take unto thee Mary thy wife for that which is conceived in her is of the Holy Ghost,while,NULL,terwyl,isenuminka,ndërsa,NULL,NULL,فيما,մինչ,gogoan,NULL,когато,NULL,nagpalandong,anae,時,lajeeˇ,ᎠᏏᏉ,NA,NULL,NULL,NULL,t,NULL,idet,Indem,te,za,NULL,kiam,kui,nɔ,kun,Comme,orasi,NA,choud,NA,NULL,Ενω,ય,NULL,जब,Dok,NULL,Sementara,NULL,Mentre,lan,NULL,NULL,NULL,NULL,때에,NULL,kamēr,NULL,tzmataq,i,असत,စဉ,जब,chica,Terwijl,Mens,ᒣᒀ,laiin,چون,raha,gdy,NULL,kwacI,NULL,tajin,tiaushcai,NULL,cînd,когда,sul,keď,ko,wakati,intuu,Mientras,kad,bado,när,ܟܕ,NULL,samantalang,เม,NA,NULL,як,NULL,NULL,muy,NULL,NULL
